Exercício,Categoria,Músculos/Objetivo,Como Fazer (Resumo),Fonte
"Rotação Externa c/ Faixa","Fortalecimento","Infraespinhal e Redondo Menor (estabilização do manguito)","Em pé, cotovelo a 90°, braço próximo ao tronco; gire o antebraço para fora contra a resistência da faixa.","https://www.physio-pedia.com/Shoulder_Impingement_Syndrome#Rehabilitation"
"Rotação Interna c/ Faixa","Fortalecimento","Subescapular (rotação interna do ombro)","Mesmo posicionamento, porém girando o braço para dentro. Manter cotovelo flexionado e próximo ao corpo.","https://orthoinfo.aaos.org/en/diseases--conditions/shoulder-impingement-rotator-cuff-tendinitis"
"Elevação em 'Scaption'","Fortalecimento","Supraespinhal (início da abdução) e deltoide","Em pé, erga os braços ligeiramente à frente do alinhamento lateral (cerca de 30°). Suba até a altura dos ombros e retorne devagar.","https://www.hss.edu/condition-list_rotator-cuff-shoulder.asp"
"Remada (Faixa ou Peso)","Fortalecimento","Trapézio Médio, Romboides (postura, estabilização escapular)","Em pé inclinado ou sentado, puxe a faixa ou halteres em direção ao tronco, unindo escápulas; retorne devagar.","https://www.nhs.uk/conditions/shoulder-pain/shoulder-pain-exercises/"
"Pêndulo (Pendular)","Mobilidade / Alívio","Alívio da rigidez e dor (movimento passivo do ombro)","Apoie-se com o braço não lesionado; deixe o outro braço relaxado e faça movimentos suaves (para frente, para trás e círculos), sem forçar.","https://www.physio-pedia.com/Shoulder_Impingement_Syndrome#Pendulum_Exercise"
"Alongamento de Peitoral","Mobilidade / Alongamento","Peitoral (reduz tensão anterior no ombro)","Braço a 90° em uma parede/portal. Gire o tronco levemente para sentir alongar o peito. Mantenha 20-30 segundos.","https://www.sbot.org.br/"
"'Sleeper Stretch'","Mobilidade / Alongamento","Rotação interna (libera a cápsula posterior do ombro)","Deitado sobre o ombro lesionado, com o cotovelo a 90°, pressione o antebraço para baixo (sem ultrapassar o limite de dor).","https://orthoinfo.aaos.org/en/diseases--conditions/shoulder-impingement-rotator-cuff-tendinitis"
"Alongamento do Infraespinhal","Mobilidade / Alongamento","Infraespinhal (rotação externa), região posterior do ombro","Braço atrás da cabeça, cotovelo para cima; puxe o cotovelo levemente para trás, sentindo o alongamento posterior.","http://www.fisioterapiabrasil.com.br/"
